{
  "$schema": "https://json-schema.org/draft/2020-12/schema",
  "$id": "https://p42.xyz/problems/erdos-min-overlap/solution.schema.json",
  "x-p42-max-bytes": 262144,
  "type": "object",
  "required": ["n", "denominator_power", "values"],
  "additionalProperties": false,
  "properties": {
    "n": { "type": "integer", "minimum": 2, "maximum": 4096 },
    "source": { "type": "string" },
    "claimed_improvement": { "type": "string" },
    "claimed_lag": { "type": "integer" },
    "claimed_score": { "type": "string" },
    "denominator_power": {
      "type": "integer",
      "minimum": 0,
      "maximum": 128
    },
    "values": {
      "type": "array",
      "minItems": 2,
      "maxItems": 4096,
      "items": {
        "type": "integer",
        "minimum": 0,
        "maximum": 340282366920938463463374607431768211456
      }
    }
  }
}
