{"denominator_power":78,"n":512,"source":"techno-optimist/erdos-minimum-overlap-bound@7c3ad988be9027920fc349b5dc975680a6d1c389:certs/lnzwz_n512_repaired.json; source sha256:c1d9dbf983d9876e639c8f3910f7601c4c812753f868b205fe3c24570ef561bc; exact binary64-to-dyadic rebuild with independently recomputed minimal repair","values":[192252155,0,0,0,0,0,0,0,0,0,0,0,0,0,0,0,0,0,0,0,0,0,0,0,0,0,0,0,0,0,0,0,0,0,0,0,0,0,0,0,0,0,0,0,3022314549036573,0,0,0,0,0,0,0,3022314549036573,0,0,0,0,2097271712698399981568,4470761818976899563520,4945896866916390141952,45240636605951635357696,84588769294341332008960,148423733749114470400000,191797235806018662825984,265468371317664100909056,259636836551499897110528,276109762528263480016896,287845098623773964238848,199457074423904325337088,173689678916150414540800,196512696300143753822208,198318405328296596209664,169067686521768821915648,185270003520755332022272,191790846633061973491712,173823086902659430481920,248123039134748352970752,249289332185334265413632,268651935414835426099200,301153038670899152158720,297152029157649903779840,298719386371207523729408,290944947630251515576320,298691148886375890157568,302205348150582699884544,302231454903657293676544,290736610421442764341248,266058559835856330293248,216902946922608319266816,158655891480516101144576,122301569892651020320768,116606060437395279446016,2890387496656577232896,0,0,0,0,0,0,0,0,0,0,0,0,0,0,0,0,0,117069012535387615133696,170203472329296777838592,177874121766324341309440,232431239420126894751744,249388581972810097754112,250714522744819774652416,259268219957526646489088,281280700936501147467776,296568840319953283317760,265708379360632196038656,224325373665723501510656,211325718769543675904000,230449716310027494490112,210303369493984711802880,197901906204922946256896,181773572443782300827648,121688496408693502377984,165092460373937406083072,141743088777342077632512,118025741317457875828736,93817760380626736775168,117990830562101958803456,130385913745150710906880,161430521307630042873856,150365208169124594712576,118913778934457651167232,142249586383356912730112,141878675852640959594496,142928966426205756588032,105887545804133595348992,147731548159521371193344,165409718776778882809856,208436869630992568025088,221661354506475230199808,224664613362280110751744,223047128039612181643264,254518752380095777734656,295405306642550614917120,297906903595619123724288,302231454903657293676544,297196109615347603079168,282396500177916291710976,226178324492592349184000,201172791014045043916800,128303599467155492438016,135624204433113657376768,125472204528181560999936,145800455389987209216000,102415033324501632811008,73485740692578460762112,88958419580080210575360,89056826141796835786752,95338413767458098774016,84056170979881014788096,86454014896795648262144,73874132290646050865152,100273584440039968866304,118431372197713173020672,103575224322013047816192,93571085111763469860864,148332320823264308887552,155552367339546909605888,224653412664561404739584,268964379270600288370688,297831016299607361585152,299711364407863216701440,302231454903657293676544,299652408117955171188736,302231454903657293676544,265064021898777591808000,179841823831991007576064,118360205757027020963840,107276142179059354304512,108506940489065358688256,115940492372035544023040,119407268498653434609664,180380817364037092245504,188602347096232102461440,201856562479933641719808,240377209623313498767360,229221084999553149566976,251149255491867744665600,299557861051917647478784,302231454903657293676544,283472014988707375349760,299467511980788757299200,297307917119774665998336,295968448467843508338688,270679663669760504102912,226647608339564905627648,267767394615768907776000,257220199882719347343360,189833502039354889994240,179953156833033836298240,183219662308374386573312,192396630294327243833344,166630292596665509478400,154441488426217590751232,174271302194910652792832,172893667754854250971136,163716016725813335425024,174203439144026603782144,210190797343976759230464,210592577795496597258240,298869063476934013353984,300510688025905125654528,302231454903657293676544,302231454903657293676544,302231454903657293676544,302231454903657293676544,302231454903657293676544,302231454903657293676544,299932313735285086093312,141155723100938655760384,100943815936748862570496,154104745161478480330752,178358009437197839630336,216005334613117202595840,285700965923992725618688,302231454903657293676544,302231454903657293676544,302231454903657293676544,302231454903657293676544,302231454903657293676544,302231454903657293676544,302231454903657293676544,302231454903657293676544,302231451881342729453568,284797402677154584461312,266920898712245635121152,295509153370455511400448,267378211171289467453440,302231454903657293676544,283846748747327843860480,267545212184011009425408,256301322568061195124736,298707865308146620694528,273061462118734309097472,260214137920455006224384,296380580346693800689664,297784119044749966442496,297150871611177644851200,302231454903657293676544,302231454903657293676544,302231454903657293676544,302231454903657293676544,302231454903657293676544,302231454903657293676544,302231454903657293676544,302231454903657293676544,302231454903657293676544,302231454903657293676544,302231454903657293676544,299056425822772451606528,287692299467118302199808,235654471395754333175808,249901362970772377698304,281847112906136088477696,259434782734638590722048,275271127664882257756160,302231454903657293676544,302231454903657293676544,302231454903657293676544,298728979197586183290880,287415008151873286832128,290506745266101232336896,201538811439820679675904,211503439931970695462912,241557320696017614536704,211377756981448977416192,228352296503916206489600,201532367865202136317952,154809424999417313755136,218276271542117781733376,287886673582710505603072,281218021155068669067264,229587676642778537787392,302231454903657293676544,302231454903657293676544,302231454903657293676544,302231454903657293676544,302231454903657293676544,302231454903657293676544,302231454903657293676544,302231454903657293676544,302231454903657293676544,302231451881342729453568,289051878600058767147008,212867966593827896033280,209693076539412337131520,198349928069043031375872,137791853762400919486464,172893664732539720302592,174271302194910652792832,155124879080473009061888,165946904964724655390720,192396630294327243833344,183219662308374386573312,179953156833033836298240,160572534564191341641728,262974109522006118498304,243388731487095458103296,266878513773009942085632,281595278546337613742080,296095443102879488933888,302231454903657293676544,302231454903657293676544,278856245539982245101568,293121766661880543182848,302208041032845900120064,251149255491867744665600,229221084999553149566976,240377209623313498767360,201856562479933641719808,188602347096232102461440,180380817364037092245504,115669227552001323171840,119560013253647209070592,108625466598734916747264,107276142179059354304512,118360205757027020963840,179841820809676443353088,265064021898777591808000,302231454903657293676544,299652408117955171188736,302231454903657293676544,299711364407863216701440,297831016299607361585152,268964379270600288370688,224653412664561404739584,155552370361861473828864,148332320823264308887552,93571085111763469860864,103575224322013047816192,118431372197713173020672,100273584440039968866304,73874132290646050865152,86454014896795648262144,84056170979881014788096,95338410745143551328256,89056826141796835786752,88230939401183467405312,74213217849160656486400,102415033324501632811008,145800455389987209216000,125472204528181560999936,135624201410799093153792,128303602489470039883776,201172791014045043916800,226178321470277784961024,282396500177916291710976,297196109615347603079168,302231454903657293676544,297906903595619123724288,295405309664865179140096,254518752380095777734656,223047131061926745866240,224664610339965580083200,221661351484160665976832,208436869630992568025088,165409718776778882809856,147731548159521371193344,105887545804133595348992,142928966426205756588032,141878672830326412148736,142249586383356912730112,118913778934457651167232,150365208169124594712576,161430521307630042873856,130385919789779805798400,117990830562101958803456,93817760380626736775168,118025741317457875828736,141743088777342077632512,165092460373937406083072,121688496408693502377984,181773575466096865050624,197901903182608415588352,210303369493984711802880,230449716310027494490112,211325718769543675904000,224325373665723501510656,265708379360632196038656,296568840319953283317760,281280700936501147467776,259268219957526646489088,250714519722505210429440,249388581972810097754112,232431242442441458974720,177874121766324341309440,170203472329296777838592,117069012535387615133696,0,0,0,3022314549036573,0,3022314549036573,0,0,0,0,3022314549036573,0,0,0,0,0,0,2890387496656577232896,116606057415080732000256,122301569892651020320768,158655891480516101144576,216902946922608319266816,266058559835856330293248,290736607399128233672704,302231451881342729453568,302205348150582699884544,298691148886375890157568,290944950652566046244864,298719386371207523729408,297152029157649903779840,301153038670899152158720,268651938437149990322176,249289326140705170522112,248123039134748352970752,173823089924973994704896,191790849655376537714688,185270006543069896245248,169067683499454291247104,198318405328296596209664,196512696300143753822208,173689678916150414540800,199457071401589761114112,287845095601459400015872,276109762528263480016896,259636833529185332887552,265468371317664100909056,191797238828333193494528,148423730726799922954240,84588766272026784563200,45240636605951635357696,4945896866916390141952,4470764841291448582144,2097271712698399981568,0,3022314549036573,0,0,0,0,0,0,0,0,0,0,0,0,0,0,0,0,0,0,0,0,0,0,3022314549036573,0,0,0,0,3022314549036573,0,0,0,0,0,0,0,0,0,0,0,0,0,0,0,0,0,0,0,0,0,0,3022314549036573,0,0,0,0]}
